  <xs:element name="BDSMS">
    <xs:complexType>
      <xs:sequence>
        <xs:element name="sms" maxOccurs="unbounded">
          <xs:complexType>
            <xs:sequence>
              <xs:element name="telefono" type="xs:string"/>
              <xs:element name="fecha" type="xs:date"/>
              <xs:element name="hora" type="xs:string"/>
              <xs:element name="mensaje" type="xs:string"/>
            </xs:sequence>
          </xs:complexType>
        </xs:element>
      </xs:sequence>
    </xs:complexType>
  </xs:element>
